{
  "id": "vr/payment.stripe.charge_succeeded",
  "version": "0.1.0",
  "tier": "HARD",
  "domain": "payment",
  "task_type": "charge_verification",
  "description": "Verifies that a Stripe charge was completed successfully.",
  "ground_truth_schema": {
    "type": "object",
    "properties": {
      "charge_id": {
        "type": [
          "string",
          "null"
        ]
      },
      "amount": {
        "type": [
          "integer",
          "null"
        ]
      },
      "currency": {
        "type": [
          "string",
          "null"
        ]
      },
      "pre_result": {
        "type": [
          "object",
          "null"
        ]
      }
    }
  },
  "scorecard": {
    "determinism": "deterministic",
    "evidence_quality": "api-state",
    "intended_use": "eval-and-train",
    "gating_required": false,
    "permissions_required": [
      "api:stripe"
    ],
    "source_benchmark": "AgentBench",
    "source_citation": "arXiv:2308.03688"
  },
  "contributor": "vr.dev",
  "created_at": "2026-03-07",
  "latency_p50_ms": 300,
  "source_citation": "arXiv:2308.03688",
  "permissions_required": [
    "api:stripe"
  ]
}
