{
  "id": "vr/tau2.policy.constraint_not_violated",
  "version": "0.1.0",
  "tier": "HARD",
  "domain": "cross-domain",
  "task_type": "policy_compliance",
  "description": "Pure-logic verifier checking agent action traces against domain policy rules. Works for any domain with codifiable constraints.",
  "ground_truth_schema": {
    "type": "object",
    "required": [
      "policies",
      "actions"
    ],
    "properties": {
      "policies": {
        "type": "array",
        "items": {
          "type": "object",
          "required": [
            "rule_id",
            "field",
            "operator",
            "value"
          ],
          "properties": {
            "rule_id": {
              "type": "string"
            },
            "description": {
              "type": "string"
            },
            "field": {
              "type": "string"
            },
            "operator": {
              "type": "string",
              "enum": [
                "eq",
                "neq",
                "lt",
                "lte",
                "gt",
                "gte",
                "in",
                "not_in",
                "contains"
              ]
            },
            "value": {}
          }
        }
      },
      "actions": {
        "type": "array",
        "items": {
          "type": "object"
        }
      }
    }
  },
  "scorecard": {
    "determinism": "deterministic",
    "evidence_quality": "hard-state",
    "intended_use": "eval-and-train",
    "gating_required": false,
    "recommended_gates": [],
    "permissions_required": [],
    "source_benchmark": "\u03c4\u00b2-bench",
    "source_citation": "arXiv:2406.12045"
  },
  "contributor": "vr.dev",
  "created_at": "2026-03-04",
  "source_citation": "arXiv:2406.12045",
  "permissions_required": [],
  "latency_p50_ms": 25
}
