{
  "id": "vr/aiv.shell.state_probe",
  "version": "0.1.0",
  "tier": "AGENTIC",
  "domain": "aiv",
  "task_type": "shell_state_verification",
  "description": "Executes a sandboxed read-only shell command and compares stdout to an expected value, probing whether an agent action actually changed system state.",
  "source_benchmark": "VAGEN",
  "source_citation": "arXiv:2602.00575",
  "ground_truth_schema": {
    "type": "object",
    "required": [
      "command",
      "expected_output"
    ],
    "properties": {
      "command": {
        "type": "string",
        "description": "Shell command to execute (must be in sandbox allowlist)"
      },
      "expected_output": {
        "type": "string",
        "description": "Expected stdout (stripped) from the command"
      },
      "cwd": {
        "type": [
          "string",
          "null"
        ],
        "description": "Working directory for command execution"
      },
      "timeout": {
        "type": [
          "number",
          "null"
        ],
        "description": "Timeout in seconds (default 15)"
      }
    }
  },
  "scorecard": {
    "determinism": "deterministic",
    "evidence_quality": "hard-state",
    "attack_surface": {
      "injection_risk": "low",
      "format_gaming_risk": "low",
      "tool_spoofing_risk": "low"
    },
    "intended_use": "eval-and-train",
    "gating_required": false,
    "recommended_gates": [],
    "permissions_required": [
      "subprocess:readonly"
    ],
    "source_benchmark": "VAGEN",
    "source_citation": "arXiv:2602.00575"
  },
  "permissions_required": [
    "subprocess:readonly"
  ],
  "contributor": "vr.dev",
  "created_at": "2026-03-04",
  "latency_p50_ms": 12000
}
