{
  "id": "vr/filesystem.file_created",
  "version": "0.1.0",
  "tier": "HARD",
  "domain": "filesystem",
  "task_type": "file_verification",
  "description": "Verifies that a file was created at the expected path with optional size and content hash checks.",
  "ground_truth_schema": {
    "type": "object",
    "required": [
      "expected_path"
    ],
    "properties": {
      "expected_path": {
        "type": "string"
      },
      "min_size_bytes": {
        "type": [
          "integer",
          "null"
        ]
      },
      "content_hash": {
        "type": [
          "string",
          "null"
        ],
        "description": "SHA-256 hex digest"
      }
    }
  },
  "scorecard": {
    "determinism": "deterministic",
    "evidence_quality": "hard-state",
    "intended_use": "eval-and-train",
    "gating_required": false,
    "recommended_gates": [],
    "permissions_required": [
      "fs:read"
    ],
    "source_benchmark": "OSWorld",
    "source_citation": "arXiv:2404.07972"
  },
  "contributor": "vr.dev",
  "created_at": "2026-03-04",
  "source_citation": "arXiv:2404.07972",
  "permissions_required": [
    "fs:read"
  ],
  "latency_p50_ms": 10
}
