{
  "id": "vr/aiv.email.sent_folder_confirmed",
  "version": "0.1.0",
  "tier": "AGENTIC",
  "domain": "email",
  "task_type": "email_verification",
  "description": "Opens IMAP connection to Sent folder and searches for a matching message by recipient and subject fragment. Proves the 'latent state' insight that UI confirmation does not equal actual delivery.",
  "ground_truth_schema": {
    "type": "object",
    "required": [
      "recipient"
    ],
    "properties": {
      "recipient": {
        "type": "string"
      },
      "subject_fragment": {
        "type": [
          "string",
          "null"
        ]
      },
      "window_minutes": {
        "type": "integer",
        "default": 10
      }
    }
  },
  "scorecard": {
    "determinism": "agentic",
    "evidence_quality": "hard-state",
    "intended_use": "eval-and-train",
    "gating_required": false,
    "recommended_gates": [],
    "permissions_required": [
      "net:imap"
    ],
    "source_benchmark": "VAGEN",
    "source_citation": "arXiv:2602.00575"
  },
  "contributor": "vr.dev",
  "created_at": "2026-03-04",
  "source_citation": "arXiv:2602.00575",
  "permissions_required": [
    "net:imap"
  ],
  "latency_p50_ms": 15000
}
