{
  "id": "vr/database.table.row_count",
  "version": "0.1.0",
  "tier": "HARD",
  "domain": "database",
  "task_type": "state_verification",
  "description": "Verifies that a database table has the expected number of rows.",
  "ground_truth_schema": {
    "type": "object",
    "required": [
      "table",
      "expected_count"
    ],
    "properties": {
      "connection_string": {
        "type": [
          "string",
          "null"
        ]
      },
      "table": {
        "type": "string"
      },
      "expected_count": {
        "type": "integer"
      },
      "tolerance": {
        "type": "integer",
        "default": 0
      },
      "pre_result": {
        "type": [
          "object",
          "null"
        ]
      }
    }
  },
  "scorecard": {
    "determinism": "deterministic",
    "evidence_quality": "hard-state",
    "intended_use": "eval-and-train",
    "gating_required": false,
    "recommended_gates": [],
    "permissions_required": [
      "db:read"
    ],
    "source_benchmark": "custom",
    "source_citation": "",
    "expected_latency_ms": 50,
    "cost_tier": "free",
    "recommended_composition": []
  },
  "contributor": "vr.dev",
  "created_at": "2026-03-15",
  "source_citation": "",
  "permissions_required": [
    "db:read"
  ],
  "latency_p50_ms": 30
}
