{
  "id": "vr/database.row.updated",
  "version": "0.1.0",
  "tier": "HARD",
  "domain": "database",
  "task_type": "state_verification",
  "description": "Verifies that a database row was updated to contain expected values.",
  "ground_truth_schema": {
    "type": "object",
    "required": [
      "table",
      "match_columns",
      "expected_values"
    ],
    "properties": {
      "connection_string": {
        "type": [
          "string",
          "null"
        ]
      },
      "table": {
        "type": "string"
      },
      "match_columns": {
        "type": "object"
      },
      "expected_values": {
        "type": "object"
      },
      "pre_result": {
        "type": [
          "object",
          "null"
        ]
      }
    }
  },
  "scorecard": {
    "determinism": "deterministic",
    "evidence_quality": "hard-state",
    "intended_use": "eval-and-train",
    "gating_required": false,
    "recommended_gates": [],
    "permissions_required": [
      "db:read"
    ],
    "source_benchmark": "custom",
    "source_citation": "",
    "expected_latency_ms": 50,
    "cost_tier": "free",
    "recommended_composition": [
      "database.row.exists"
    ]
  },
  "contributor": "vr.dev",
  "created_at": "2026-03-15",
  "source_citation": "",
  "permissions_required": [
    "db:read"
  ],
  "latency_p50_ms": 30
}
