{
  "id": "vr/git.ci.passed",
  "version": "0.1.0",
  "tier": "HARD",
  "domain": "git",
  "task_type": "ci_verification",
  "description": "Verifies that all CI check runs passed for a given commit SHA.",
  "ground_truth_schema": {
    "type": "object",
    "required": [
      "repo",
      "commit_sha"
    ],
    "properties": {
      "repo": {
        "type": "string"
      },
      "commit_sha": {
        "type": "string"
      },
      "pre_result": {
        "type": [
          "object",
          "null"
        ]
      }
    }
  },
  "scorecard": {
    "determinism": "deterministic",
    "evidence_quality": "api-state",
    "intended_use": "eval-and-train",
    "gating_required": false,
    "permissions_required": [
      "api:github"
    ],
    "source_benchmark": "SWE-bench",
    "source_citation": "arXiv:2310.06770"
  },
  "contributor": "vr.dev",
  "created_at": "2026-03-07",
  "latency_p50_ms": 200,
  "source_citation": "arXiv:2310.06770",
  "permissions_required": [
    "api:github"
  ]
}
